title,source,author,url,publishedAt,content
"Benjamin Netanyahu's Churchill moment comes amid multi-front war against Iranian terror, expert says",Fox News,,https://www.foxnews.com/world/benjamin-netanyahus-churchill-moment-comes-amid-multi-front-war-against-iranian-terror-expert-says,2024-10-07T13:15:46Z,"JERUSALEM - Israeli Prime Minister Benjamin Netanyahu was reeling exactly a year ago from the worst massacre of Jews since the Holocaust: A staggering 3,800 trained Hamas terrorists from an overall number of 6,000 Palestinians invaded southern Israel on Oct. 7, 2023.

The Iranian-backed Hamas and its supporters unleashed a scale of unprecedented barbarism, including beheadings and burning bodies, within the territory of the Jewish state, resulting in the mass murder of nearly 1,200 people, including over 30 Americans.

The U.S. designated terrorist movement Hamas also kidnapped more than 250 people on that fateful day that jolted Israel like none of the numerous wars against Iran-backed proxies that the tiny Jewish state has fought within this century. As of Monday, 101 hostages still remain in Hamas captivity, .

TRUMP SAYS ISRAEL SHOULD HIT IRAN'S NUCLEAR FACILITIES, SLAMMING BIDEN'S RESPONSE

After a year of intense war with Hamas, including the opening of six additional fronts against the Islamic Republic of Iran's ""Axis of Resistance,"" Netanyahu has bounced back to take on the threat to Israel's very existence. He is in his prime as a modern war planner and head of state, a number of Israeli experts told Fox News Digital, including Israel's top diplomat to the United Nations.

""Prime Minister Netanyahu's leadership in this war is a case study in tenacity and courage.""

""Netanyahu was completely shocked during the first hours on the first day of the attack, but at the same time, he understood what was going on and controlled events. Netanyahu responded very quickly,"" Ariel Kahana, the senior diplomatic correspondent for the widely read Hebrew-language daily Israel Hayom, told Fox News Digital.

Kahana referenced Netanyahu's public announcement on Oct. 7, in which he declared, ""Citizens of Israel, we are at war, not in an operation or in rounds, but at war. This morning, Hamas launched a murderous surprise attack against the State of Israel and its citizens.""

FEDERAL AUTHORITIES ISSUE WARNING AHEAD OF OCT 7 ATTACKS ANNIVERSARY

Israel's ambassador to the U.N., Danny Danon, said, ""This isn't a war Israel started nor is it a war Israel wanted. But, under the leadership of Prime Minister Netanyahu, Israel has succeeded in mitigating the threat of Hamas by destroying its tunnel infrastructure and taking out its leaders. Israel is also successfully degrading Hezbollah in the north by eliminating its senior leadership and launching a targeted operation in southern Lebanon with the goal of pushing the group north of the Litani River and reducing the threat the terrorist organization poses to our northern border.""

Danon, who is a member of Netanyahu's conservative Likud party, added, ""While we are making progress, there is still work to be done. We still have 101 hostages who are held in brutal captivity in Gaza, and we still have 70,000 Israelis who are refugees in their own country, unable to return to their homes in the north.""

ISRAEL'S UN AMBASSADOR SLAMS WORLD BODY, SAYS UNRWA TAKEN OVER BY TERRORISTS IN GAZA

Prior to Oct. 7, Netanyahu was an embattled prime minister. His right-wing coalition government had suffered public humiliation when his administration was forced to abandon its judicial reform plan because of massive civil society protests.

Now, with a string of tactical victories over Hezbollah and Hamas' top leaders, including Israeli control over most of the Gaza Strip, Bibi, as he is known in Israel by his nickname, has gained popularity in political polling.

""Bibi made the right actions against Hamas and Hezbollah. That is why you see him rising in the polls.""

One key turning point for Israel is the near total decimation of the leadership of the U.S. classified terrorist movement Hezbollah, including its leader Hassan Nasrallah, in Lebanon.

ISRAEL WAS BEHIND LEBANON PAGER ATTACK TARGETING HEZBOLLAH, SENIOR US OFFICIAL SAYS, AS NEW BLASTS REPORTED

The de facto ruler over the Lebanese state, Hezbollah, launched missiles at Israel one day after the Hamas invasion, on Oct. 8. Last week, Israeli ground troops entered south Lebanon, with a view toward rooting out Hezbollah terrorists and missiles that sparked the flight of as many as 70,000 Israelis from their homes in the north.

Kahana noted, ""Bibi made the right actions against Hamas and Hezbollah. That is why you see him rising in the polls. He is the only one to use the term victory. You don't hear that from the security establishment."" He cited the examples of Bibi's defense minister, Yoav Gallant, and Herzi Halevi , the chief of staff of the Israel Defense Forces, who ""are not talking about a complete defeat of Hamas.""

The veteran Israeli commentator said Israel's seizure of the southern Gaza city of Rafah was a telling example of a clash between Bibi and his war planners, Gallant and Halevi. There was hesitation on the part of Gallant and Halevi while Netanyahu wanted to expedite the capture of Rafah, the last major holdout of sizeable Hamas terrorist forces. Kahana chalked up a possible explanation of delay from Gallant and Halevi to the Biden administration's interference in having expressed opposition to the IDF operation in Rafah.

After a four-month offensive in Rafah, the IDF, in September, declared victory over Hamas' Rafah brigade. The incursion into Rafah also secured the release of four Israeli hostages in June. From May to September, the IDF eliminated thousands of Hamas and Palestinian Islamic Jihad terrorists in Rafah.

HEZBOLLAH'S NEIGHBORS: ISRAELI BORDER COMMUNITY UNDER CONSTANT ATTACK FROM TERROR GROUP

According to Kahana, ""Bibi had to push the army to act."" He compared Bibi to Britain's WWII prime minister, Winston Churchill, who demanded that his army do certain things but encountered resistance. Kahana noted, ""Netanyahu has full responsibility for what brought about Oct. 7, but he is leading the war better than Gallant, Halevi and Benny Gantz.""

""What is the strategy, what is the exit plan in the war against Hezbollah?""

Gantz, a retired general and leader of the main opposition party, left Bibi's war cabinet in June.

Yet Bibi still has many critics who believe he should have tendered his resignation on Oct. 7 or a few months into the war against Hamas. Netanyahu has also been accused of forgoing the hostages held by Hamas in Gaza and thousands of Israelis have protested on a near weekly basis against his policies since the war began.

Yossi Melman, a veteran Israeli columnist for the left-leaning Haaretz newspaper, is one of Bibi's sharpest critics. Melman said, ""His performance is very bad."" He said Bibi has ""no vision and no strategy."" Melman asked, ""What is the strategy, what is the exit plan in the war against Hezbollah?""

HEZBOLLAH BIGGER CHALLENGE THAN HAMAS TO ISRAEL: 'CROWN JEWEL IN THE IRANIAN EMPIRE OF TERROR'

He claimed, ""Most of his decisions are about political and personal survival.""

Israel's then-attorney general, Avichai Mandelblit, charged Netanyahu with fraud, breach of trust and accepting bribes in a legal saga that started four years ago and is still unfolding. Netanyahu has vehemently denied all the allegations against him.

Melman also claimed that Netanyahu, along with his cabinet, military and security chiefs, refused to accept responsibility for Oct. 7.

As one of Israel's leading intelligence experts, he attributed the penetration of Hezbollah's leadership structure to the ""last four chiefs of the Mossad and the military chiefs. ""Israel's foreign intelligence agency, the Mossad, built these abilities over the years,"" he said.

He also claimed that Netanyahu also ""strained relations with the U.S. in an unprecedented way. His performance is full of ungratefulness. The U.S. sent air carriers and the U.S. provided $14 billion in extra military aid and resupplied ammunition. Without that, Israel could not sustain one year against Gaza and now Lebanon and also Iran.""

Melman also noted that Bibi has failed to secure the freedom of 101 hostages held by Hamas in Gaza.

CLICK HERE TO GET THE FOX NEWS APP

Caroline Glick, who served as an adviser to Netanyahu, took issue with criticism against him, pointing out, ""Prime Minister Netanyahu's leadership in this war is a case study in tenacity and courage. Israel's other political leaders and military leadership all demanded that he capitulate to continuous pressure from the Biden-Harris administration to stand down and permit Hamas to survive and accept Hezbollah's continued presence on the border, sufficing with an entirely defensive posture.""

She continued, ""Had Israel agreed, its regional standing would have completely collapsed. He refused. His tenacious refusal to give up the fight and determination to fight to victory is the reason Israel has been able to turn the corner. Israel is winning today in a way that seemed unimaginable a year ago. We never would have made it to this turning point had it not been for Netanyahu."""
One year after 10/7 attacks and Democrat-run states have let antisemitism fester,Fox News,,https://www.foxnews.com/opinion/one-year-after-10-7-attacks-democrat-run-states-have-let-antisemitism-fester,2024-10-07T09:22:57Z,"By entering your email and pushing continue, you are agreeing to Fox News' Terms of Use and Privacy Policy, which includes our Notice of Financial Incentive.

October 7th was the worst attack on the Jewish people since the Holocaust. Hamas invaded Israel, murdering people at random, raping, destroying homes and kidnapping people back to Gaza. There are more than 100 still held hostage, including four Americans.

Raw and hurting, American Jews watched the streets of U.S. cities fill up with crowds. The people in the streets weren't marching to stand with the slaughtered and the raped. They were gleeful, exuberant and there were many of them.

In New York's Times Square, hundreds of people gathered on October 8, while Israel was still sorting through their dead, and counting how many children and elderly had been kidnapped, to flash swastikas and chant ""death to Israel"" as well as ""700,"" the number of Israeli dead counted at the time. That number was later revised to 1,195.

AS OCTOBER 7TH ANNIVERSARY APPROACHES, JEWISH STUDENTS BRACE FOR PROTESTS, VOW TO 'WALK PROUDLY'

In Los Angeles, it's been nearly a year of violent protests outside synagogues and in Jewish neighborhoods. One Jewish man was killed after a confrontation in November.

It seemed like antisemitism was festering all over the country.

But a closer look showed that it wasn't, actually, happening everywhere, it was very specifically happening in places primarily run by Democrats. It's not that antisemitism can't exist in red areas. It can, it does. Vandalism, verbal harassment, even physical assault can happen in Republican-led places. But the occurrence is far rarer and the real difference is the consequences.

According to the Anti Defamation League (ADL) ""The states with the highest number of incidents were California (1,266), New York (1,218), New Jersey (830), Florida (463) and Massachusetts (440)."" Four of those states are blue states. In my red home state of Florida, we had approximately the same number of incidents as Massachusetts while having about three times the population and a third of the incidents of New York despite having over 2 million more people.

The ADL is a left-leaning Jewish organization, and yet they admit, ""On a per capita basis, the states with the highest concentration of antisemitic incidents were New Jersey - with 8.93 incidents per 100,000 residents - followed by Vermont (6.64), Massachusetts (6.28), New York (6.23), Maryland (5.49) and Connecticut (5.09). On the city level, two cities - Manhattan (26.84 per 100,000) and Washington, D.C. (25.75 per 100,000) - stood out with far and away the highest levels of incidents per capita. Brookyln [sic], NY, stood out specifically in terms of physical assault incidents, with 1.16 assaults per 100,000 residents."" Again, all deep blue states and cities.

The argument to defend the blue states, and their rampant antisemitism, is that Jews primarily live in those blue states, so of course, antisemitism will be higher. But that doesn't explain Florida's low count. It's also hard not to notice that Mississippi had 19 incidents of vandalism and harassment while New Hampshire had 35 when they each have under 1% of their population being Jewish and Mississippi is nearly double New Hampshire's population. There is a pattern, and it's related to whom the population elects.

Antisemitism simply does not thrive in red areas the same way as it does in areas dominated by Democrats. Jew-hatred, and the chaos that accompanies it onto our streets is put down as quickly as it surfaces in places like Florida.

Last October, Dr. Ahmed ElKoussa was fired from his job as a Miami dentist after ripping down posters of kidnapped hostages being held by Hamas. Anti-Israel agitators protested outside Real-Time Laboratories, an American company which is a subsidiary of an Israeli weapons manufacturer, in Boca Raton, but were met with even more pro-Israel protesters. When the anti-Israel protesters got violent, Boca Raton Police immediately took action and made arrests.

And in May, when anti-Israel protesters pulled their usual move of attempting to block a highway in Orlando, they lasted a total of 11 minutes before Florida Highway Patrol arrested them. Governor Ron DeSantis boasted, ""I think that's the world record.""

CLICK HERE FOR MORE FOX NEWS OPINION

Meanwhile, in New York, the Manhattan district attorney has dropped all charges against the violent anti-Israel protesters who occupied Columbia University's Hamilton Hall. In California, protesters have spent the last year blocking traffic for the Palestinian cause. Only some incidents yielded arrests. In March, protesters stopped traffic outside San Francisco International Airport and blocked security lines inside for four hours. No one was arrested. This simply does not happen in red states.

School campuses in red states were relatively quiet, while Ivy League campuses in the northeast featured Jewish students being told to ""go back to Poland"" and assaulted. The protests that did spring up on red state campuses were quickly brought under control.

Antisemitism simply does not thrive in red areas the same way as it does in areas dominated by Democrats. Jew-hatred, and the chaos that accompanies it onto our streets is put down as quickly as it surfaces in places like Florida.

It was obvious to the students at some of the red-state universities that the protests were about Israel, yes, but they were about America too. U.S. flags were often torn down and replaced with Palestinian flags. At the University of North Carolina, fraternity brothers protected an American flag from being defaced, while at Princeton University, protesting students halted a Memorial Day parade because it featured an American flag.

CLICK HERE TO GET THE FOX NEWS APP

Open antisemitism exposes a deep rot in societies and the hatred of Jews for the last year has caused many to notice that the same people hate America too. History is filled with examples of governments and societies that no longer exist because succumbing to the world's oldest hatred was a clear sign that their civilization was on a downhill trajectory. What is happening in blue cities is exposing their own decay.

Cities, like New York, that had been prospering not so long ago have had a hard time bouncing back from the bad policies enacted during the COVID-19 pandemic coupled with the rolling back of crime policies during the Bill de Blasio administration. Antisemitism is a symptom of a larger problem and places that control antisemitic activity can count on flourishing in a way that places that don't won't. Jew-hatred can happen anywhere, the acceptance of it does not."
"One year after 10/7, Iran is losing the war. Now, Israel must secure peace",Fox News,,https://www.foxnews.com/opinion/one-year-after-10-7-iran-losing-war-now-israel-must-secure-peace,2024-10-07T09:22:56Z,"By entering your email and pushing continue, you are agreeing to Fox News' Terms of Use and Privacy Policy, which includes our Notice of Financial Incentive.

One year ago, Iran took a gamble and started a war in Gaza with the attack by Hamas that killed nearly 1,200 Israelis, including over 40 Americans, and took more than 200 hostages

A year later, it is clear that Iran is losing this war.

For his part, Ayatollah Khamenei on Friday, October 4, 2024, remembered the massacre as ""logical and legal"" and used his first public Friday sermon in five years to proclaim that Iran ""won't back down."" He also had a rifle at the podium. He's that worried.

ISRAELI MILITARY KILLS 250 HEZBOLLAH TERRORISTS SINCE START OF LIMITED GROUND OPERATION IN LEBANON

You can measure the defeat of Iran in two ways. The first is restoring Israel's security and carrying out the military destruction of Iran's terror agents Hamas, Hezbollah, the Houthis and more.

Israeli strikes of the past several weeks have brought this goal closer.

Second, getting Israel and Saudi Arabia back on track toward normalizing relations will be the ultimate defeat for Iran.

Of all the vile causes for the Hamas attack, the strategic tipping point came because Saudi Arabia and Israel were close to a historic normalization of relations.

Iran couldn't stand it.

Last fall, Israeli Prime Minister Benjamin Netanyahu and Saudi Arabia's Crown Prince Mohammed Bin Salman were in serious, quiet negotiations. National Security Advisor Jake Sullivan wrote in his Foreign Affairs article that the work toward joint infrastructure projects and new partnerships between Israel and its Arab neighbors was ""bearing fruit.""

""Every day we get closer,"" bin Salman said in an interview aired Sep. 20, 2023.

""We can forge a historic peace between Israel and Saudi Arabia,"" Israeli Prime Minister Benjamin Netanyahu said to President Joe Biden during a televised meeting in New York on the sidelines of the United Nations General Assembly sessions that same day.

The impending deal included a significant Palestinian component of concessions by Israel. ""It is not a done deal and there are many variables, but the odds are more than 50%,"" a senior Israeli official told Axios at the time.

Diplomacy was bubbling along, with Netanyahu invited to Washington, D.C., at the end of the year.

You can imagine how that went over in Tehran.

Less than two weeks later, Iran gave ""the green light for the assault at a meeting in Beirut"" on Monday, Oct. 2, 2023, sending word to Hamas and Hezbollah, according to the Wall Street Journal.

The objective was to force Israel into a war to blacken its reputation and scorch any path to peace.

To do it, Iran coached Hamas to change tactics.

Just three years earlier, in May 2021, Hamas waged an all-out missile war with huge salvoes to overwhelm Israel's missile defenses, to no avail. Even with the incredibly brief warning times characteristic of short-range launches, Israel's multi-layered defensive system held. Of course, the Israeli Air Force hit weapons caches and launch sites. Egypt stepped in to broker the ceasefire.

This time, the kind of war sought by Iran would have to go beyond missile attacks.

Officers of Iran's Islamic Revolutionary Guard Corps began specific planning with Hamas for the attack in August 2023. The goal was ""the most significant breach of Israel's borders since the 1973 Yom Kippur War,"" the Journal reported Oct. 8, 2023.

And so it was. Note Iran was content to let the civilians of Gaza pay a terrible price being caught of the middle of a war zone.

Most of the Hamas military structure in Gaza was destroyed by the spring of 2024. Biden offered a ceasefire on May 30. Hamas toyed with agreement, but this time there would be no ceasefire despite strenuous efforts by Egypt and Qatar. Iran wasn't ready.

Enter Hezbollah. A surge in rocket attacks across the alleged UN ""blue line"" effectively saw Hezbollah take the lead in fighting. Now, Israel would have to contend with Hezbollah, too. The war entered a new phase with the July 30 killing of Ismail Haniyeh, head of the Hamas Politburo, in Tehran itself.

Israel's systematic campaign has decimated Hezbollah's leadership, culminating with the pager attacks and the death of Hassan Nasrallah. Israel's strikes in Lebanon are now attempting to restore border safety.

A year after the initial attack, Iran is the loser by any military standard. Two big missile attacks on Israel have been thwarted. The military advantage rests with Israel. However, I suspect more strikes on legitimate military and infrastructure targets to reduce Iran's power may be required.

CLICK HERE FOR MORE FOX NEWS OPINION

Despite Israel's military successes, dangers remain. For a year, the American military has done everything President Joe Biden asked in the name of deterrence. This includes steps that made sense: U.S. Navy destroyers intercepting Iran's missiles, aircraft carriers and F-22s deployed with strike options. And measures that didn't, such as the Gaza aid pier. The bottom line is 40,000 U.S. forces deployed to the U.S. Central Command region, all to keep a lid on Iran. That can't go on forever (although China would like it).

The path ahead depends on restoring Israel's security and taking out Iran's capabilities. After that, the goal is to get back to the normalization of relations between Israel and Saudi Arabia, a goal shared by the Trump and Biden administrations. It's not easy - the two-state dilemma remains. But it is the one sure way to defeat Iran, for good.

Of all the vile causes for the Hamas attack, the strategic tipping point came because Saudi Arabia and Israel were close to a historic normalization of relations.

And it's important for Americans to stay committed to Israel's security and to the diplomatic goals, despite the pain caused by the shock unleashing of antisemitism. Too many 21st Century Americans turned out to be biased, ignorant, susceptible to foreign instigation, or all of the above. We Americans have to do better than this.

CLICK HERE TO GET THE FOX NEWS APP

Don't forget that in the words of the Justice Department's Indictment of Hamas, the government of Iran's regional and global campaign of terrorism aims to ""weaken and ultimately destroy both the United States and Israel.""

America's best interest remains to support Israel - and take all military steps necessary to get back to the regional diplomacy that will shut down Iran for good."
