title,source,author,url,publishedAt,content
One boy's story shows the impact of rising Israeli settler violence in the West Bank,NPR,,https://www.npr.org/sections/the-picture-show/2024/10/08/g-s1-22630/photos-palestinian-family-impact-israeli-settler-violence-occupied-west-bank,2024-10-08T11:33:53Z,"Noor Assi, 15, sits on his bed while watched by his 5-year-old sister Jenna in the village of Qarawat Bani Hassan, Israeli-occupied West Bank, on Feb. 23. Ayman Oghanna for NPR hide caption

In a carpentry shop in the village of Qarawat Bani Hassan, in the Israeli-occupied West Bank, Noor Assi is at work packaging a wooden table. He tears off strips of tape, tying it to padded cardboard, before flipping the table on its side.

He says he is 15 ""and a half,"" a measurement in age split between the innocence of youth and a desire for manhood.

The war in Gaza has caused tensions to flare across the Middle East, especially in places like the West Bank. The Israeli-occupied territory is the most violent it has been in decades. United Nations figures say that almost 700 Palestinians in the area have been killed, either by Israeli forces or settlers, in the past year. Noor's father was among those fatally shot.

""My childhood is gone,"" Noor says. He was forced to grow up by a grim rite of passage.

On Dec. 2, Israeli settlers raided his village in the central West Bank and shot his father, Ahmed Assi, dead, according to the family, residents and local officials.

The Israeli military told NPR that they responded to a physical confrontation between Palestinians and Israeli citizens in Qarawat Bani Hassan with riot disposal means and live fire and that the circumstances of Assi's death were still under review.

Ahmed Assi's mother, Noor's grandmother, shows bloodied clothes and a sweatshirt with a single bullet hole in the back. Assi's 5-year-old daughter, Jenna, looks on, wearing a necklace with a picture of her dead dad.

""When my father was martyred, I started to work, I took over my father's profession, I started working and spending on the house. I was smart and managed things, meaning I became responsible for the house,"" Noor says.

Noor dropped out of school, working full time in the family's carpentry warehouse, sometimes for 13 hours a day, to provide for his five siblings.

""I am responsible for them now. I take care of them and whatever they want, I get them. I don't let them want for anything.""

Noor looks young, is shy and has a boyish haircut -- long on top, a fade on the sides and back. He maintains his look with regular visits to the village barbershop.

In the Middle East, the barbershop is not just a place to cut your hair. It's also a place to socialize, hang out and talk about everything from family to sports and politics. Not long after Noor gets his trim, the village's mayor, Ibrahim Assi, enters. He is a distant relative of Noor's. It's a small community and family ties are strong. A poster of Noor's deceased father is plastered outside.

The mayor explains that Qarawat Bani Hassan is surrounded by an ever-expanding network of Israeli settlements and outposts. About 500,000 Israeli settlers live in the occupied West Bank, according to the United Nations. The settlements they live in are deemed illegal by the international community. Israeli politicians like Prime Minister Benjamin Netanyahu, however, have promoted their expansion, and they're growing through a web of smaller outposts.

The mayor says that violence from the settlers is terrorizing the Palestinians who live here.

""The West Bank is currently living in a nightmare, a nightmare that has lost its security and safety due to the violence of the Ministry of Settlers, who are -- on a daily basis -- assaulting, killing and harassing and stealing. They are committing real crimes against citizens and farmers that are present on their own land,"" the mayor says.

On Dec. 2, he says, settlers entered the village, damaging property, burning cars, wounding one man and shooting Noor's father dead. His lifeless body was found hours later in an olive grove on the outskirts of Qarawat Bani Hassan.

Noor may maintain his teenage haircut. But he has the hardened hands of an older working man, no longer hanging out with friends, devoting himself, instead, to work, faith and family.

At home, he helps out with the household chores, learning to cook from his mother. He sometimes feels pangs of envy for other teenagers.

""I do get jealous, I sometimes feel like playing, like them, but it doesn't work. I have a family to take care of,"" Noor says.

On Friday, the holiest day of the week in Islam, Noor prays at the village mosque before his weekly ritual of visiting his father's grave, draped in a Palestinian flag.

Prayer is important to Noor, from morning to night. Fighting back tears, he says the Islamic funeral prayer for his father on the porch outside his home.

""O God, forgive him and have mercy on him, and heal him, and pardon him, and grant him an honorable reception.""

Noor says that each night, after prayer, he speaks to his father.

""I tell him what is happening, what we are doing, and who is coming over, for example,"" he says. ""Last time, he came to me in a dream and told me, 'Take care of your family and your brothers.' """
Harris and Trump marked 1 year since the Oct. 7 attacks with tributes to the victims,NPR,,https://www.npr.org/2024/10/07/nx-s1-5144699/kamala-harris-donald-trump-october-7,2024-10-07T22:25:41Z,"One year after Hamas attacked Israel, both major-party presidential candidates marked the date on Monday with promises of continued support for the Jewish state.

Vice President Harris remembered the victims of the Oct. 7 attack by planting a memorial tree at her residence at the Naval Observatory in Washington, D.C., while former President Trump visited a sacred site for Hasidic Jews in Queens, N.Y.

""I will never forget October 7, and the world must never forget,"" Harris said during a tree-planting ceremony on the grounds of the vice president's residence. ""We must work to ensure nothing like the horrors of October 7 can ever happen again.""

Hamas, which controls Gaza, killed about 1,200 people in Israel on Oct. 7 and took some 250 hostage in Gaza, according to Israel. A year later, more than 100 hostages are still unaccounted for. Israel's response to the attack has killed at least 41,000 people in Gaza, according to Gaza health officials.

Harris reiterated her support for Israel's defense, and promised the Biden administration would continue working to free the remaining hostages in Gaza. She then read the names of seven missing American citizens.

Harris also called for efforts to ""relieve the immense suffering of innocent Palestinians in Gaza who have experienced so much pain and loss over the year.""

She appeared alongside her husband Doug Emhoff, who is Jewish and and who has led White House efforts to fight antisemitism.

Trump met with members of an Orthodox Jewish community in New York on Monday morning, and visited the grave of Rabbi Menachem Mendel Schneerson, an influential orthodox rabbi who died in 1994. Trump was then scheduled to attend an Oct. 7 remembrance event Monday evening with Jewish leaders, according to Trump campaign officials.

Hamas' stated goal is the elimination of Israel and the establishment of a Palestinian state. Israel says the objective of the war in Gaza is to eliminate Hamas.

The war has exposed rifts within the Democratic Party over the Biden-Harris administration's support for Israel. Those divides are particularly pronounced among younger voters -- a key voting bloc for Democrats and a group more likely than older voters to express sympathy for the Palestinian people. According to the Pew Research Center, voters ages 18-29 also are less supportive of U.S. military aid to Israel.

Trump has sought to capitalize on those tensions within his rival's party, saying recently that any Jewish voter who supports a Democrat is a ""fool."" Those remarks drew widespread criticism from Jewish organizations across the ideological spectrum.

He continued emphasizing the message in an interview Monday with radio host Hugh Hewitt. ""I did more for Israel than anybody, I did more for the Jewish people than anybody, and it's not a reciprocal, as they say,"" Trump said."
"'All this blood, all this death': Palestinians protest Israel war with no end in sight",NPR,,https://www.npr.org/2024/10/07/nx-s1-5144289/israel-hamas-gaza-war-palestinians-protest-west-bank,2024-10-07T21:43:45Z,"A year after the Hamas attack, Israel continues its military campaign in Gaza, while its operations in the occupied West Bank have expanded significantly.

For Palestinian civilians caught in the middle of the ongoing conflict between Israeli forces and the Hamas militant group, the consequences have been unremittingly difficult, and deadly.

The death toll from Israel's offensive in Gaza is now approaching 42,000 Palestinians, with another 39 deaths recorded Monday at local hospitals, according to Gaza's health authorities.

Hamas, designated a terrorist group by the United States and several other nations, has seen its control over territory in Gaza diminish over the past 12 months, leaving a political and logistical vacuum that international aid groups have struggled to fill.

Cease-fire talks between Hamas and Israel, brokered by the United States, Qatar and Egypt, are on hold, so for civilians in Gaza, the forced displacement that for many began last October, still has no end in sight.

In the Deir al-Balah region of central Gaza, 58-year-old Abu Nidal Musleh lives in a makeshift tent, wearing mismatched shoes.

The father of seven comes from the same area of northern Gaza were civilians were once again ordered to evacuate Monday, and he's been displaced four times in the last year.

When Hamas-led fighters attacked communities in southern Israel a year ago, they killed more than 1,200 and seized about 250 hostages, according to Israeli officials. Musleh was a teacher on his way to school that day.

He told NPR on Monday he feels empathy for the Israeli hostages held by Hamas -- but he blames Israel's prime minister Benjamin Netanyahu for the suffering both sides have endured, and he insists peace will only be possible if Israeli citizens oust their premier.

""Rise up against Netanyahu,"" he said. ""Rise up -- so we can have normal relations.""

Meanwhile, in the West Bank, violence has worsened in the past year between Palestinian militants belonging to Hamas and other armed groups, and Israeli settlers and the Israeli military, which oversees the occupied territory with a vast network of checkpoints and military outposts.

Over the past few months, some of the heaviest Israeli airstrikes in decades have rocked Palestinian communities in the West Bank, killing dozens, alongside large-scale raids into cities including Jenin.

In Ramallah, the Israeli-occupied West Bank's biggest city, dozens of Palestinians gathered in the main square Monday, waving Palestinian flags and carrying anti-occupation signs.

Basma Abu Sway said she had come to mark one year since the war in Gaza began, and called last Oct. 7 one of the most important days in Palestinian history.

She said she hopes the sacrifices made by Palestinians in Gaza and the West Bank will not be for nothing.

""All this blood, all this death is bringing peace to Palestine,"" she said. ""We deserve as Palestinian people to live in complete liberation.""

Settler violence and Israeli military raids into towns and villages in the West Bank have killed more than 730 Palestinians since the beginning of the war, according to a combined count of data from the United Nations and Palestinian health authorities.

On Monday the Palestinian advocacy group, Palestinian Prisoners' Club,, announced that Israeli military forces had arrested 45 people through Sunday night into Monday morning across the West Bank.

Rima Nazzal was also in Ramallah's Manara Square Monday, and said she felt concern and fear -- worried that Israel's occupation of Palestinians would grow stronger as a result of the its military's actions after Oct. 7 last year.

""The world says Israel has a right to defend itself,"" she said. ""As if it says Israel has a right to defend its occupation."""
Photos: A look back at the year since Oct. 7,NPR,,https://www.npr.org/sections/the-picture-show/2024/10/07/g-s1-25745/israel-gaza-photos-october-7,2024-10-07T20:28:40Z,"A Palestinian girl carries a child through the rubble of houses destroyed by Israeli bombardment in Gaza City on March 3, amid the ongoing conflict between Israel and the Hamas movement. AFP/via Getty Images hide caption

This story is a part of an NPR series reflecting on Oct. 7, a year of war and how it has changed life across Israel, the Gaza Strip, the region and the world.

NPR journalists have spent the past year witnessing, capturing and documenting the suffering and pain that war has inflicted on people in the Gaza Strip, Israel, the occupied West Bank and Lebanon.

For Israelis, it began when Hamas militants stormed out of the Gaza Strip on Oct. 7 last year, attacking soldiers, families in their homes and a rave packed with young people. The attacks killed around 1,200 people and took 250 hostage, according to Israeli authorities.

Israelis have been divided since: Many have spent the past year in rallies demanding a cease-fire that frees the hostages. Others have pressed their government to continue fighting Hamas, even blocking aid crossing into Gaza.

In Gaza, nothing looks the same a year into the war. Among the more than 41,000 Palestinians killed by Israeli fire this past year are hundreds of families, according to Gaza's Health Ministry. More than half of those killed are women and children. Around 100,000 others in Gaza have been wounded, thousands of them children who have lost limbs.

A year on, nearly everyone in Gaza is displaced, huddling in bombed out schools and under makeshift tents without electricity, running water or safety.

Below is a collection of moments from the past 365 days of this war, captured by NPR photographers and others across the region."
"'If You Can Keep It': The War In Gaza, One Year Later : 1A",NPR,,https://www.npr.org/2024/10/07/1210935852/1a-10-07-2024,2024-10-07T19:10:16Z,"Israeli army soldiers stand by as a yellow ribbon along with the number 365, signifying the number of days since the October 7, 2023 attacks.

Today is Oct. 7, marking one year since the Hamas-led attacks in southern Israel.

Hamas fighters killed over 1,200 people. In response, the Israeli government launched airstrikes and a ground invasion in Gaza, killing almost 42,000 people so far according to Palestinian health authorities.

Despite repeated attempts, the United States has failed to broker a ceasefire - in both Gaza and now at Israel's northern border as its military targets the Iran-backed militant group Hezbollah in Lebanon.

Last week, Israel said it secured $8.7 billion from the U.S. for its ongoing military efforts.

Typically, each week leading up to Nov. 5, we focus on the stakes of this election, for people, our country and our democracy.

Today's ""If You Can Keep It"" discussion will sound a little different.

What are the stakes of the U.S. election for the people of a Middle East in conflict?"
"1 year after Hamas attacked Israel, the conflict grows more dangerous than ever",NPR,,https://www.npr.org/2024/10/07/g-s1-26381/hamas-israel-hezbollah-gaza-lebanon,2024-10-07T16:07:28Z,"A girl walks through the rubble of a collapsed building in Khan Younis, in the southern Gaza Strip, on Oct. 2, amid the war in the Palestinian territory between Israel and Hamas. Bashar Taleb/AFP via Getty Images hide caption

Thousands breached a border fence. Others arrived in speedboats. Some even came by paraglider in a dawn attack by Hamas fighters a year ago that caught Israel by surprise, leaving 1,200 people dead and another 250 as hostages. It also set in motion events that now threaten to turn Israel's long-running conflict with Iran's proxies into a direct and dangerous war with Tehran.

Saturday, Oct. 7, 2023, marked the deadliest day in the history of modern Israel, triggering a devastating attack on Palestinians. The result has been a humanitarian catastrophe for Gaza. Beginning in the days after the Hamas attack, Israeli warplanes began punishing airstrikes inside the narrow strip of Palestinian territory that also lies adjacent to Egypt and the Mediterranean Sea. By the end of the month, Israeli forces had launched a full-scale ground invasion of Gaza.

At the one-year mark in the Israel-Hamas war, here are four things that are key to where things stand today.

In the aftermath of the Hamas attack, as Israelis mourned those killed, they also feared for the safety of the hostages. A central plaza in downtown Tel Aviv, unofficially dubbed Hostages Square, was quickly transformed into a gathering place for the families, friends and supporters of the captives. ""Bring them home now!"" emerged as a potent rallying cry, and posters showing the faces and names of the hostages became ubiquitous. Many Israelis began wearing special necklaces, bracelets and T-shirts to show their support for the captives. Daily vigils in Hostages Square drew large crowds.

Israeli Prime Minister Benjamin Netanyahu -- already weathering intense criticism for intelligence failures in the lead-up to the surprise attack -- came under intense pressure to halt the fighting in Gaza and secure the release of the hostages.

Although Israel and Hamas managed a brief cease-fire in November that allowed for the exchange of more than 100 hostages for nearly 250 Palestinian prisoners, the truce lasted just a week. Hamas did unilaterally release four hostages, and eight others were rescued by Israeli forces. Israel's military also recovered the bodies of several hostages.

The fate of the remaining captives in Gaza has remained an open wound for many Israelis. Netanyahu's office believes that of the 101 hostages still unaccounted for in Gaza, about a third are likely dead.

The hostages question continues to shape Israel's public response to the conflict.

Since the start of Israel's military response, the country's attacks have killed at least 41,000 Palestinians in Gaza, including 16,500 children, according to Gaza's Health Ministry. Another 95,000 people have been injured, the ministry says.

Israel's military began its assault on Hamas in the north of Gaza, and as Palestinian civilians sought to escape the fighting, most of them fled southward, displacing them from their homes and cutting them off from critical infrastructure needed for daily survival.

Recent data from the U.N. Office for the Coordination of Humanitarian Affairs, the World Health Organization and Palestinian officials in Gaza indicate the attacks have damaged or destroyed more than half of Gaza's homes, 80% of its commercial facilities and 85% of the territory's schools.

U.N. Secretary-General António Guterres has called the humanitarian situation in Gaza a ""moral stain on us all,"" and the aid group Refugees International has said that Israel's military response ""has wrought disproportionate death and suffering among civilians in Gaza, generating famine-like conditions while obstructing and undermining the humanitarian response.""

Khan Younis, Gaza's second-largest city, which Israeli authorities considered to be a Hamas stronghold, experienced some of the most intense bombardment of the conflict.

In the first few months of fighting, Rafah, near the border with Egypt in southern Gaza, was designated as a ""safe zone"" by the Israeli military -- meant as a place where civilians could shelter and get access to desperately needed international humanitarian aid. Even so, Israel continued to carry out airstrikes on Rafah, some targeted at Hamas fighters or facilities, while others aimed to free Israeli hostages, according to the Israeli military. Some of those airstrikes hit homes, killing and injuring dozens of civilians, and others destroyed food distribution sites. More than half of Gaza's prewar population of 2.2 million was believed to be sheltering in Rafah. In May, Israel issued evacuation orders for the city and launched an offensive that sealed the border with Egypt, which until then was one of the main entry points for humanitarian aid.

Food, drinking water and materials for temporary shelters are in short supply and are being carried in by trucks operated by international relief organizations. People in Gaza are down to one meal every other day, and an estimated 50,000 children between the ages of 6 months and 5 years are in urgent need of treatment for malnutrition.

U.S. efforts to speed aid to Gaza have also floundered. A special $230 million temporary floating pier known as the Joint Logistics Over-the-Shore system (JLOTS) operated only intermittently as damage from high winds and rough seas in the eastern Mediterranean repeatedly rendered it inoperable.

Besides the brief cease-fire to facilitate a hostages-for-prisoners swap, repeated rounds of peace talks -- some mediated by Qatar -- have failed to make much progress. Deep-seated animosities and the fragmented nature of the Palestinian leadership have played a part in preventing any lasting peace deal.

Meanwhile, the U.S. has tried to walk a fine line between diplomatic and military support for its long-term ally, Israel, and a desire to mitigate the suffering in Gaza while trying to contain a wider war that increasingly has dragged Iran and Israel into direct conflict and could engulf the rest of the Middle East.

For the moment, cease-fire talks that at times sparked optimism have fallen silent.

In late September, Secretary of State Antony Blinken summed up the U.S. position, saying, ""Israel has the right to defend itself against terrorism. The way it does so matters.""

Meanwhile, public opinion in the U.S. has been split largely along partisan lines, with conservatives showing support for Israel, but some people, younger and more liberal, turning out for pro-Palestinian rallies on college campuses.

Among Democrats, more than half say that Israel bears ""a lot"" of responsibility for the continuation of the war in Gaza, while only about 4 in 10 Republicans do, according to a Pearson Institute/AP-NORC poll published last week.

That political dichotomy could influence the outcome of a likely tight U.S. presidential race, with some Democrats suggesting that Netanyahu is ignoring the Biden administration's peace entreaties in an effort to tip the election toward former President Donald Trump. Meanwhile, voters in key battleground states give Trump higher marks than his opponent, Vice President Harris, on foreign policy matters, according to a recent poll by the New York-based Institute for Global Affairs.

From the opening days of the conflict in Gaza, the Biden administration warned against allowing the Hamas attack to morph into a war that could bring in Hezbollah -- the Lebanon-based, Iran-backed militant group -- as a primary combatant and could eventually lead to a direct conflict with Tehran.

But increasingly in recent weeks, that's exactly what seems to be happening.

On Oct. 8, 2023, Hezbollah began launching rockets against Israel in support of the Palestinian militants fighting in Gaza. Israel hit back, and for months, low-level conflict simmered along the Lebanon-Israel border. Iran, Hezbollah's main backer, mostly stayed out of the conflict. But an Israeli attack in April against an Iranian diplomatic base in Syria that killed several of Iran's Islamic Revolutionary Guard Corps officers changed the dynamic. Less than two weeks later, Iran retaliated with a large-scale drone and missile strike on Israel. The attack, heavily telegraphed by Tehran in an apparent effort to contain the fallout, was easily repulsed by Israeli air defenses, assisted by the United States.

Fast-forward to last month: In an operation credited to Mossad, Israel's intelligence agency, in synchronized attacks over two days, electronic pagers belonging to members of Hezbollah suddenly exploded across Lebanon, killing more than a dozen people -- including two children -- and wounding thousands more, according to Lebanese health authorities.

Soon after, Israel launched hundreds of airstrikes against southern Lebanon that it said were aimed at Hezbollah targets. One that hit a residential building in downtown Beirut killed a top Hezbollah commander.

As Israeli airstrikes continued days later, multiple residential buildings in southern Beirut were demolished. On Sept. 27, Israel announced that Hezbollah leader Hassan Nasrallah, who led the militant group for more than three decades, was killed in one of the strikes. Hezbollah later confirmed his death.

Israel also hit ports and power stations in Yemen operated by another Iran-backed group, the Houthis.

The United Nations says about 1 million Lebanese have fled their homes amid the Israeli airstrikes. Israeli authorities say about 63,000 Israelis remain displaced from the border area with Lebanon due to Hezbollah rocket fire.

On Oct. 1, Israel opened a ground offensive in southern Lebanon, a move that hearkened back to a similar 1982 invasion of the country's south by Israeli forces, which led to an 18-year occupation and to a monthlong war that Israel fought against Hezbollah in 2006. Less than 24 hours later, Iran launched a massive ballistic missile attack on Israel. The country's extensive defenses -- bolstered by two U.S. destroyers deployed in the region -- intercepted most of the Iranian missiles. However, Israeli officials acknowledge that some of the Iranian missiles did hit an air base."
