title,source,author,url,publishedAt,content
"Israel strikes Lebanon, hitting Beirut suburbs and the north",AP NEWS,,https://apnews.com/article/mideast-wars-lebanon-hezbollah-hamas-5-october-2024-a8b70daeccc57a86fc6d939c604f2caf,2024-10-05T12:04:14Z,"TEL AVIV, Israel (AP) -- Israel expanded its bombardment in Lebanon on Saturday, hitting Beirut's southern suburbs with 12 airstrikes and striking a Palestinian refugee camp deep in northern Lebanon for the first time.

The attack on the Beddawi refugee camp near the northern city of Tripoli killed an official with Hamas's military wing, along with his wife and two young daughters, the Palesitnian militant group said in a statement. Tripoli is much farther north than the majority of Israel's strikes, which have been concentrated in southern Lebanon and Beirut.

Israel has killed several Hamas officials in Lebanon since the Israel-Hamas war began in October last year, in addition to most of the top leadership of Hezbollah.

At least six people were killed in more than a dozen Israeli airstrikes overnight and into Saturday, according to National News Agency, Lebanon's official news agency.

The Israeli military said special forces were carrying out targeted ground raids against Hezbollah infrastructure in southern Lebanon, destroying missiles, launchpads, watchtowers and weapons storage facilities. The military said troops also dismantled tunnel shafts that Hezbollah used to approach the Israeli border.

Some 1,400 Lebanese, including Hezbollah fighters and civilians, have been killed and some 1.2 million driven from their homes since Israel escalated its strikes in late September aiming to cripple Hezbollah and push it away from the countries' shared border. On Tuesday, Israel launched what it called a limited ground operation into southern Lebanon. Nine Israeli troops have been killed in close fighting in the area in the past few days, the military said.

Also on Saturday, Palestinian medical officials say Israeli strikes in northern and central Gaza early Saturday have killed at least 9 people, including two children.

One strike hit a group of people in the northern town of Beit Hanoun, killing at least five people, including two children, according to the Health Ministry's Ambulance and Emergency service.

Another strike hit a house in the northern part of the Nuseirat refugee camp, killing at least four people, the Awda hospital said. The strike also left a number of people wounded, it said.

The Israeli military did not have any immediate comment on the strikes, but it has long accused Hamas of operating from within civilian areas.

The Israeli military warned Palestinians to evacuate along the strategic Netzarim corridor in central Gaza, which was at the heart of obstacles to a ceasefire deal earlier this summer. The military told people in parts of the Nuseirat and Bureij refugee camps to evacuate to Muwasi, an area along Gaza's shore the military has designated a humanitarian zone.

It's unclear how many Palestinians are currently living in the areas ordered evacuated, parts of which were evacuated previously.

Almost 42,000 Palestinians have been killed in Gaza during the nearly year-long war, according to the Palestinian Health Ministry, which does not differentiate between civilian and militant deaths."
"A van packed with migrants skids off a road in Croatia, killing 2 and injuring 25",AP NEWS,,https://apnews.com/article/croatia-migration-deadly-van-accident-d1db4dc5da650285d8ed44f948c44554,2024-10-05T08:10:37Z,"ZAGREB, Croatia (AP) -- A van packed with migrants slid off the road and overturned in central Croatia early Saturday, killing two people and injuring 25, including some seriously, police and doctors said.

The accident happened around 1 a.m. near Peklenica, some 100 kilometers (60 miles) southeast of Zagreb, the capital, said a police statement.

A patrol spotted the van with German license plates overnight and started to follow it when the driver increased the speed, the statement said. After several kilometers (miles), the officers saw the van overturned in a ditch by the road after it apparently hit a concrete bridge, a house and a power pole.

Doctors told Croatian media that 9 people were seriously injured and were being treated in hospitals in the area. They include people from Iraq, Turkey and Syria, as well as Palestinians.

A similar accident in September in Croatia injured 14 people, illustrating the dangers migrants face as they flee wars and poverty in the Middle East, Africa and Asia.

Migrants often seek help from people smugglers to cross borders without authorization to reach wealthy Western European countries. Migrants are often forced to travel in crammed boats or vans."
Middle East latest: A Hamas official is killed in an Israeli strike on a refugee camp,AP NEWS,,https://apnews.com/article/israel-hezbollah-hamas-latest-mideast-5-october-2024-e8c20151ce6d01f8ac697a835314e70d,2024-10-05T06:49:34Z,"An Israeli strike on a refugee camp in north Lebanon has killed Hamas official Saeed Atallah Ali and his family, the militant group said Saturday. The early morning strike came a day after another Israeli airstrike cut off a main highway linking Lebanon with Syria, leaving two huge craters on either side of the road.

Israel began a ground incursion Tuesday into Lebanon against the Hezbollah militant group. The Israeli military said nine soldiers have died in the conflict in southern Lebanon.

Israel and Hezbollah have traded fire across the Lebanon border almost daily since the day after Hamas' cross-border attack on Oct. 7, 2023, which killed 1,200 Israelis and took 250 others hostage. Israel declared war on the Hamas militant group in the Gaza Strip in response. As the Israel-Hamas war reaches the one-year mark, more than 41,000 Palestinians have been killed in the territory, and just over half the dead have been women and children, according to local health officials.

Nearly 2,000 people have been killed in Lebanon since then, most of them since Sept. 23, according to the Lebanese Health Ministry.

Here is the latest:

BEIRUT -- An Israeli strike on a refugee camp in north Lebanon has killed a Hamas official and his family, the militant group said Saturday.

Hamas said in a statement that the early Saturday strike on the Beddawi refugee camp struck the home of Saeed Atallah Ali, an official with Hamas's military wing, the Qassam Brigades. Ali's wife, Shaymaa Azzam, and their two daughters, Zeinab and Fatima -- whom the statement described as children -- were also killed in the attack.

Beddawi camp is near the northern city of Tripoli. It was the first such strike on the camp in recent weeks that saw intensified exchanges between Israel and Hamas.

Israel has killed several Hamas officials in Lebanon since the Israel-Hamas war began in October 2023.

SEOUL, South Korea -- A military plane evacuating 97 people from Lebanon arrived in South Korea on Saturday.

South Korea's Foreign Ministry said the group on the plane includes South Korean nationals and their family members. There are about 30 South Koreans left in Lebanon besides diplomats and embassy workers who are staying.

South Korean President Yoon Suk Yeol instructed officials Wednesday to send military aircraft to conflict areas in the Middle East as he called a meeting to discuss the impact of the intensified fighting in the region. There are about 480 South Korean nationals living in Israel and 110 in Iran."
"One year in, war casts a shadow over every aspect of life in Israel",AP NEWS,,https://apnews.com/article/israel-hamas-gaza-war-israelis-mood-depression-28daf7e6aa8ddab419cf76e31b111d4f,2024-10-05T04:13:18Z,"TEL AVIV, Israel (AP) -- At a busy Tel Aviv entertainment district, diners spill into outdoor seating and clink glasses as music fills the air. There's laughter, there's life. But all around the patrons, staring down from lampposts and shop windows, are pictures of hostages held in Gaza, stark reminders that Israel is at war and forever scarred by the deadliest attack in its history.

As Israel's war with Hamas reaches its one-year mark, it can seem on the surface that much of life in the country has returned to normal. But with many still reeling from Hamas' Oct. 7 attack, hostages remaining in captivity and a new front of warwith Hezbollah in the north, many Israelis feel depressed, despondent and angry as the war stretches into its second year.

Uncertainty over the future has cast a pall over virtually every part of daily life, even as people try to maintain a sense of normalcy.

""The conversation about the situation is always there,"" said activist Zeev Engelmayer, whose daily postcard project featuring illustrations of hostages or Israel's new reality has become a fixture at anti-war protests. ""Even those who are sitting in coffee shops, they're talking about it, in every single situation I see it. It's impossible to get away from it. It has entered into every vibration of our life.""

Hamas' attack in which some 1,200 people were killed and 250 kidnapped shattered Israelis' sense of security and stability in their homeland.

Many have been rattled by the war's evolution. Nearly 100 hostages remain in Gaza, with less than 70 believed to be alive. Israelis have experienced attacks -- missiles from Iran and Hezbollah, explosive drones from Yemen, fatal shootings and stabbings -- -- as the region braces for further escalation.

They've watched as Israel is accused of committing war crimes and genocide in Gaza and becomes increasingly isolated internationally.

""I'm almost 80 -- we grew up in this country with a feeling that we have short wars, and we win them quickly,"" said Israeli historian Tom Segev, who described new feelings of utter hopelessness. ""We're not used to a long war.""

Israelis have long harbored a sense that their country, born of the Holocaust's ashes and surviving a panoply of regional threats, is a success story, Segev said. They've strived, he added, for a normality akin to that of European and North American people, though their reality for decades has been anything but.

""I think that history is going backward,"" he said of the past year. ""Everything we have achieved on our way to becoming a normal state isn't happening.""

Reminders are everywhere. At a Hebrew University graduation in Jerusalem, a large yellow ribbon was placed in front of the stage. A graduate who didn't attend because his brother was killed in Gaza the previous day was honored.

Israel's longstanding internal divisions briefly eased in the aftermath of Hamas' attack, but have only intensified since. Weekly protests calling for a cease-fire deal that would free hostages are attended mostly by secular Jewish Israelis who oppose Prime Minister Benjamin Netanyahu and his government.

According to a September poll by Jerusalem-based think tank Israel Democracy Institute, 61 percent of right-wing Jewish Israelis -- Netanyahu's base -- support the war continuing.

Occupied with their own trauma, most Israelis paid scant attention to the ongoing destruction in Gaza, even as the Health Ministry there put the Palestinian death toll at more than 41,000. Israeli media have reported little on the devastation. Israelis calling for a cease-fire are driven overwhelmingly by the hostages' plight.

Many Israelis are furious at leaders and the military for not preventing Hamas' attack. Tens of thousands of people are expected at an alternative ceremony marking one year since then, as a statement against the government's official commemoration. The state ceremony is being prerecorded without a live audience, in part because of fears of heckling and disruptions.

""The thing we lost on Oct. 7 -- and we haven't gotten it back -- is our feeling of security,"" Muli Segev, executive producer of ""Eretz Nehederet,"" a popular sketch comedy show. ""Despite everything, we have been able to create a life here that's pretty open and Western.

""Especially in Tel Aviv, we go about our lives, and we don't think about the fact that our lives are really just pauses between wars and between explosions of violence.""

In the war's early months, the show's sketches were gentler, focusing on what united Israeli society, such as the massive civilian volunteer response. Over time, they featured more pointed satire, including a reimagining of negotiations if the hostages were Israeli politicians' children -- released in less than two hours.

Parts of life have rebounded -- beaches full of people, bustling cafes, concerts and sports back on schedules. But residents also check for the nearest bomb shelter, deal with school cancellations when violence flares up, and avoid domestic travel hubs that are now off-limits. Heartbreaking news arrives regularly, including the deaths of six hostages in August.

""It's a nightmare; we're just getting used to it,"" said Maya Brandwine, a 33-year-old graphic designer who witnessed the Jaffa shooting that killed seven on Tuesday. ""I have so little hope. I'm sure the situation will only get worse.""

Dror Rotches, a 47-year-old graphic designer, said from a Tel Aviv coffee shop: ""We try to go out when we can, meet friends and try to forget for a few hours. Then we go home and keep slogging through the mud.""

Others simply can't return home. More than 60,000 from Israel's northern border with Lebanon are displaced. Thousands from the southern towns ransacked Oct. 7 are in temporary housing. Tens of thousands of reserve soldiers are serving their second or third tour of duty, straining their families and jobs.

""As the war goes on and on and we can't see the end, there's also a type of very large worry over the future, and, for some, if there is even a future here,"" Muli Segev said.

Cafe Otef seems like any of Tel Aviv's ubiquitous coffee shops: Patrons laugh and sip specialty coffee beside a playground; light rock music plays. But next to the sandwiches and cakes are chocolates made from the recipes of Dvir Karp, who was killed in the Oct. 7 attack, and cheeses from Kibbutz Be'eri, where more than 100 died and 30 were taken hostage. Totes and T-shirts for sale declare ""We shall thrive again.""

The cafe, named for the region next to the Gaza border, is run by residents of Re'im, one of the kibbutzes struck. It's the second shop in the new chain, each aiming to support people of a southern Israeli town where lives were upended.

""The war still continues for almost a year, and I feel that if we won't live, we will die,"" said Reut Karp, cafe owner and Dvir's ex-wife. She lives with most of her kibbutz in temporary housing nearby.

The cafe gives her purpose as her community deals with trauma and the uncertainty of returning home. While it's strange to see people flowing through the doors, going about life as normal, she and the staff have found comfort in the routine.

""We must take ourselves out of bed and continue to live and to work and to have the hope,"" Karp said. ""Because without this hope, we don't have anything."""
Virginia man charged with defacing monument during Netanyahu protests in DC,AP NEWS,,https://apnews.com/article/netanyahu-protests-washington-congress-37861883e2db60606aaf434bf9ec83ad,2024-10-04T20:55:03Z,"WASHINGTON (AP) -- A Virginia man was arrested Friday on a charge that he spray-painted graffiti on a monument in the nation's capital during protests against Israeli Prime Minister Benjamin Netanyahu's address to Congress in July.

Zaid Mohammed Mahdawi, 26, of Richmond, Va., was charged in a complaint with one count of destruction of federal property. He was among thousands of protesters who gathered in Washington, D.C., on July 24 to condemn Netanyahu's visit.

Some demonstrators who gathered outside Union Station that day removed American flags and hoisted Palestinian ones in their place. Others burned flags and sprayed graffiti on structures in Columbus Circle, in front of Union Station.

Videos posted on social media showed Mahdawi climbing the statue of Christopher Columbus in the middle of Columbus Circle and using red spray paint to write ""HAMAS IS COMIN"" on the monument, according to an FBI agent's affidavit. He also spray-painted an inverted red triangle above the slogan, the affidavit says.

The FBI later received a tip from a witness who knew Mahdawi from a Richmond gym and recognized his image in a police bulletin.

A group of protesters had a permit to demonstrate in front of Union Station, but the U.S. Park Police said it revoked the permit after it couldn't reach protest organizers that afternoon. The National Park Service estimated that it cost more than $11,000 to clean up and fix damage at the site.

""Politically motivated destruction or defacing of federal property is not protected speech, it is a crime,"" Matthew Graves, U.S. Attorney for the District of Columbia, said in a statement.

Mahdawi was expected to make his initial court appearance in Virginia on Friday.

A Maryland woman was arrested last month on a related charge. Isabella Giordano, 20, of Towson, is accused of using red spray paint to write ""Gaza"" on a fountain in front of Union Station and spray-painting the base of two of the flagpoles in Columbus Circle."
Relatives say a whole family was killed in Israel's deadliest West Bank strike since Oct. 7,AP NEWS,,https://apnews.com/article/israel-hamas-west-bank-strike-tulkarem-militants-1656f77bb28acdfb3d72ec5fccd628e9,2024-10-04T12:17:08Z,"TULKAREM, West Bank (AP) -- An Israeli airstrike on a West Bank cafe that the military said targeted Palestinian militants also killed a family of four, including two young children, relatives told The Associated Press on Friday.

The strike slammed into a three-story building in the Tulkarem refugee camp late Thursday, setting it on fire, destroying a popular cafe and killing at least 18 Palestinians, according to the territory's Health Ministry. It was the deadliest strike in the West Bank since the start of the Israel-Hamas war nearly a year ago.

On Friday, paramedics searched the rubble inside the blasted-out coffee shop, gathering human remains into small boxes. Young boys and men walked among the ruins of the shop, with holes in the ceiling and debris blanketing the ground, digging past bloodstained furniture and dislodged iron beams for anything to salvage.

Among the dead was the Abu Zahra family: Muhammad, a bakery worker; his wife, Saja; and their two children, Sham, 8, and Karam, 6, according to the man's brother, Mustafa Abu Zahra, who said the family lived above the coffee shop. He added that one of Muhammad's brothers-in-law was also in the apartment at the time and was killed.

The Israeli military said the strike killed several militants, including Hamas' leader in the camp, who it accused of planning and taking part in multiple attacks against Israeli civilians. Tulkarem, known to be a hotbed of Palestinian militancy, is a flashpoint in the West Bank and a frequent target of Israeli military raids.

Hamas, which did not immediately claim any of the dead as its fighters, condemned the strike and called for Palestinians in Tulkarem to rise up.

Israel has carried out several large-scale raids in the West Bank since the start of the war in Gaza, ignited by Hamas' Oct. 7 attack on southern Israel. While airstrikes used to be rare in the Palestinian territory, they have grown more common since the outbreak of war as Israeli forces clamp down, saying they aim to prevent attacks on their citizens.

Israeli fire has killed at least 722 Palestinians in the West Bank since Oct. 7, Palestinian health officials say. In that time, Palestinian militants have launched a number of attacks on soldiers at checkpoints and within Israel.

A shooting attack in Tel Aviv earlier this week that Israeli police said was carried out by Palestinians from the West Bank left at least six people dead.

Nimer Fayat, the owner of Dr. Coffee, said the cafe was full with ""regular customers coming to eat and drink"" when the strike occurred around 10:15 p.m.

""What happened was a very strong blow, the likes of which we had not seen in the past since the Al-Aqsa Intifada,"" he said, using a Palestinian term for the second intifada, or uprising, in the early 2000s.

Paramedics rushing to the area encountered a ghastly scene, with body parts flung onto power lines by the force of the blast, said Nebal Farsakh, a spokesperson for the Palestinian Red Crescent, whose teams brought nine dead to the hospital.

A full list of the dead and wounded was not immediately released by the Palestinian Health Ministry.

Yasser Jibra, another relative of the Abu Zahras, said the strike was ""like a lightning bolt.""

""Look around, the destruction is so obvious,"" he said, adding that it was difficult to identify the bodies of his loved ones.

The Israeli military did not immediately respond to a request for comment on civilian deaths in the strike. Israel says it takes care to guard against such deaths.

But to Jibra, that means little.

""This is the work of the criminal occupation, which does not take into account the presence of a child or a woman, or an elderly or young person,"" he said, as he stood inside the blasted-out cafe. ""Everything is permissible for them.""

Associated Press reporter Julia Frankel and producer Ibrahim Hazboun contributed to this report from Jerusalem."
