title,source,author,url,publishedAt,content
Gaza está en ruinas tras un año de ofensiva israelí. La reconstrucción podría tomar décadas,AP NEWS,,https://apnews.com/world-news/general-news-domestic-news-b79a673b1fc3b067d91af0455a4ad182,2024-10-07T18:24:31Z,"Hay montañas de escombros donde antes había bloques de apartamentos y charcos de agua contaminada con aguas residuales que propagan enfermedades. Las calles de las ciudades se han convertido en cañones de tierra y, en muchos lugares, el aire está impregnado del hedor de cadáveres no recuperados.

La ofensiva israelí contra Hamás, una de las más mortíferas y destructivas en la historia reciente, ha matado a más de 41.000 personas, un poco más de la mitad de ellas mujeres y niños, según los funcionarios de salud locales. Sin un final a la vista para la guerra, y sin un plan para el día después, es imposible decir cuándo -- o hasta si -- algo será reconstruido.

Incluso después de que cesen los combates, cientos de miles de personas podrían quedar atrapadas y vivir en campamentos de tiendas de campaña durante años. Los expertos dicen que la reconstrucción podría tomar décadas.

""Esta guerra es destrucción y miseria. Haría que las piedras clamaran"", dijo Shifaa Hejjo, un ama de casa de 60 años, quien vive en una tienda de campaña instalada en el terreno donde antes estuvo su casa. ""Quienquiera que vea Gaza ... lo hará llorar"".

Israel culpa a Hamás por la destrucción. El ataque de ese grupo palestino contra Israel el 7 de octubredel año pasado -- en el que murieron unas 1.200 personas y unas 250 fueron tomadas como rehenes -- provocó la guerra. Israel dice que Hamás incrustó gran parte de su infraestructura militar, incluidos cientos de kilómetros (millas) de túneles, en áreas densamente pobladas donde se libraron algunas de las batallas más duras.

Los combates dejaron aproximadamente una cuarta parte de todas las estructuras en Gaza destruidas o gravemente dañadas, según una evaluación de la ONU en septiembre con base en videos satelitales. Dijo que alrededor del 66% de las estructuras, incluidas más de 227.000 unidades de vivienda, habían sufrido al menos algún daño.

Si hay un alto al fuego, alrededor de la mitad de las familias ""no tendrán a dónde regresar"", dijo Alison Ely, coordinadora en Gaza del Shelter Cluster, una coalición internacional de proveedores de ayuda liderada por el Consejo Noruego para los Refugiados.

Casi tantos edificios han sido destruidos o dañados en Gaza como en toda Ucrania después de sus primeros dos años de guerra con Rusia, según Corey Scher y Jamon Van Den Hoek, investigadores con sede en Estados Unidos que utilizan radares satelitales para documentar la devastación de las guerras.

Para poner eso en perspectiva: Gaza tiene menos de la mitad del tamaño de Kiev, la capital de Ucrania.

La cantidad de destrucción solo en el centro y sur de Gaza, dijo Scher, es aproximadamente equivalente a lo que se perdió en la ciudad de primera línea de Bajmut, escenario de una de las batallas más mortíferas en la guerra de Ucrania y donde las fuerzas rusas destruyeron casi todos los edificios a su paso para obligar a las tropas ucranianas a retirarse. La destrucción en el norte de Gaza es aún peor, agregó.

El sistema de agua y saneamiento de Gaza ha colapsado. Más del 80% de sus instalaciones sanitarias -- y un porcentaje mayor de sus carreteras -- están dañadas o destruidas.

""No puedo pensar en ningún paralelo, en términos de la severidad de los daños, para un enclave, un país o un pueblo"", manifestó Scher.

A finales de enero, el Banco Mundial estimó que los daños ascendían a 18.500 millones de dólares: casi la producción económica combinada de Cisjordania y Gaza en 2022. Eso fue antes de algunas operaciones terrestres israelíes intensamente destructivas, incluso en la ciudad sureña fronteriza de Rafah.

En enero, cuando las fuerzas terrestres israelíes avanzaron hacia la ciudad de Jan Yunis, en el sur, Shifaa Hejjo y su familia huyeron de su casa de cuatro pisos con solo la ropa que vestían.

Pasaron meses en varios campamentos de tiendas de campaña antes de que ella decidiera regresar. Y lo que vio la hizo llorar.

Todo su vecindario había sido destruido: su antigua casa y los caminos que conducían a ella estaban hundidos en un mar de escombros.

""No la reconocí"", dijo. ""No sabía dónde estaban las casas de la gente"".

Alrededor del 90% de los 2,3 millones de habitantes de Gaza han sido desplazados por la guerra, a menudo varias veces, según estimaciones de la ONU. Cientos de miles se han apiñado en campamentos de tiendas de campaña en expansión cerca de la costa sin electricidad, agua corriente ni baños. El hambre está extendida.

Hejjo vivió en una tienda de campaña en el patio de un hospital. Antes de eso, estuvo en Muwasi, el principal campamento de tiendas de campaña en el sur de Gaza.

""Olía mal"", reportó. ""Había enfermedades que se propagaban"".

Agregó que su esposo, quien sufría una enfermedad hepática, se sintió destrozado cuando escuchó que su casa había sido destruida y murió poco después.

Ella fue una de las primeras en regresar después de que las fuerzas israelíes se retiraran en abril. Sus vecinos se mantuvieron alejados, temerosos de encontrar cuerpos o bombas sin explotar.

Pero para ella, ese todavía era su hogar.

""Es mejor vivir en mi casa, donde viví durante 37 años, aunque esté destruida"", dijo.

Hejjo y sus hijos cavaron entre los escombros con palas y con las manos, ladrillo por ladrillo, para rescatar todo lo que se pudiera reutilizar. Usaron ropa rasgada para alimentar el fuego de la cocina.

Las ratas se habían colado y enjambres de mosquitos revoloteaban sobre las ruinas. Había vidrios rotos por todas partes. Montaron una tienda de campaña fortificada con láminas de metal corrugado y algunos ladrillos rescatados de su casa destruida. Una ligera llovizna mojó sus ropas mientras dormían.

Las agencias de la ONU dicen que el desempleo se ha disparado a alrededor del 80%, en comparación con casi el 50% antes de la guerra y que casi toda la población vive en la pobreza. Incluso a quienes tienen medios les resultaría casi imposible importar materiales de construcción debido a las restricciones israelíes, los combates en curso y el colapso de la ley y el orden.

El primer obstáculo para cualquier reconstrucción significativa son los escombros: montañas de ellos.

Donde antes había casas, tiendas y edificios de oficinas, ahora hay enormes montones de escombros con restos humanos, sustancias peligrosas y municiones sin explotar.

La ONU estima que la guerra ha dejado unas 40 millones de toneladas de escombros en Gaza, suficientes para llenar el Central Park de Nueva York a una profundidad de ocho metros (unos 25 pies). Podría tomar hasta 15 años y casi 650 millones de dólares limpiarlo todo, dijo.

También está la cuestión de dónde deshacerse de ellos: la ONU calcula que se necesitarían unos cinco kilómetros cuadrados (unas dos millas cuadradas) de terreno, que será difícil de conseguir en el territorio pequeño y densamente poblado.

No sólo se destruyeron viviendas, sino también infraestructura crítica.

La ONU estima que casi el 70% de las plantas de agua y saneamiento de Gaza han sido destruidas o dañadas. Eso incluye las cinco instalaciones de tratamiento de aguas residuales del territorio, además de plantas de desalinización, estaciones de bombeo de aguas residuales, pozos y embalses.

Los empleados que antes gestionaban los sistemas municipales de agua y de residuos han sido desplazados y algunos han muerto. Y la escasez de combustible ha dificultado el mantenimiento de instalaciones que siguen intactas.

La organización benéfica internacional Oxfam dijo que solicitó un permiso para traer unidades de desalinización y tuberías para reparar la infraestructura hídrica en diciembre. Israel tardó tres meses en aprobar el envío, que aún no entra en Gaza, agregó Oxfam.

La destrucción de las redes de alcantarillado ha dejado las calles inundadas de agua pútrida, lo que acelera la propagación de enfermedades.

No ha habido energía central en Gaza desde los primeros días de la guerra, cuando su única planta eléctrica se vio obligada a cerrar por falta de combustible, y más de la mitad de la red eléctrica del territorio ha sido destruida, según el Banco Mundial.

Los países árabes ricos, como Arabia Saudí y Emiratos Árabes Unidos, han dicho que están dispuestos a contribuir a la reconstrucción de Gaza sólo como parte de un acuerdo de posguerra que cree una ruta hacia un estado palestino.

Benjamin Netanyahu, el primer ministro israelí, ha descartado esa posibilidad y ha dicho que no permitirá que Hamás o incluso la Autoridad Palestina, apoyada por Occidente, gobiernen Gaza. Ha informado que Israel mantendrá un control de seguridad ilimitado y delegará los asuntos civiles a los palestinos locales. Pero hasta donde se sabe, nadie se ha ofrecido como voluntario y Hamás ha amenazado con matar a cualquiera que ayude a la ocupación.

La reconstrucción de Gaza también requeriría la importación de cantidades masivas de materiales de construcción y equipo pesado, algo que es poco probable que Israel permita mientras exista la posibilidad de que Hamás reconstruya su infraestructura bélica. En cualquier caso, Gaza sólo tiene un pequeño número de cruces con capacidad limitada.

El organismo militar israelí que coordina los asuntos civiles en Gaza dice que no restringe la entrada de suministros civiles y permite los llamados artículos de doble uso que también podrían utilizarse con fines militares. Israel autorizó la entrada de algunos materiales de construcción antes de la guerra bajo lo que se conocía como el Mecanismo de Reconstrucción de Gaza, pero estaban sujeto a fuertes restricciones y retrasos.

La coalición Shelter Cluster estima que se necesitarían 40 años para reconstruir todas las casas destruidas en Gaza bajo esas condiciones.

Por ahora, los proveedores de asistencia tienen dificultades para traer suficientes tiendas de campaña básicas debido al número limitado de camiones que entran en Gaza y a las dificultades para entregar la ayuda. Los esfuerzos para traer viviendas temporales más sólidas todavía están en las primeras etapas, y nadie ha intentado traer materiales de construcción, según Ely.

En septiembre, Shelter Cluster estimó que 900.000 personas todavía necesitaban tiendas de campaña, ropa de cama y otros artículos para prepararse para los inviernos típicamente fríos y lluviosos de la región.

El Deeb reportó desde Beirut. El periodista de The Associated Press, Mohammad Jahjouh, en Jan Yuni, Franja de Gaza, contribuyó a este despacho."
Países de todo el mundo conmemoran aniversario de ataques de 7 de octubre,AP NEWS,,https://apnews.com/world-news/general-news-6532e68218f1d799153128395777e026,2024-10-07T17:41:23Z,"BUDAPEST (AP) -- Vigilias, conmemoraciones y actos de recordación se planearon en todo el mundo el lunes por el primer aniversario de los ataques de Hamás contra Israel, pidiendo el fin del antisemitismo y la liberación de los rehenes israelíes.

El sorpresivo ataque transfronterizo del año pasado, en que murieron unas 1.200 personas, tomó desprevenido a Israel durante una importante festividad judía, quebrantando el sentido de seguridad de los israelíes y dejando a muchos países, que de antemano estaban nerviosos por la invasión rusa de Ucrania, enfrentando la posibilidad de otra conflagración bélica en el Oriente Medio.

Las naciones de Europa, hogar de muchas comunidades judías y musulmanas, han tratado de sofocar los ánimos antisemitas y antiislámicos luego del ataque del grupo Hamás y la subsiguiente represalia israelí en Gaza, que ha matado a unas 41.000 personas y ha desplazado a unas 1,9 millones.

El Vaticano conmemoró el aniversario recaudando fondos para el pueblo de Gaza y publicando una carta del papa Francisco en que expresa su solidaridad con los católicos de la región.

Francisco no mencionó a Israel, a Hamás ni a los rehenes en la carta fechada el 7 de octubre. Mencionó que el año pasado fue prendida ""la mecha del odio"" y la subsiguiente espiral de violencia, insistiendo en que lo que se necesita es diálogo y paz.

""Estoy con ustedes, pueblo de Gaza, desde hace tiempo atribulado y en dificultades. Están en mis pensamientos y mis oraciones a diario"", escribió el pontífice.

Luego de unos comentarios que enojaron a Israel a inicios del conflicto, el papa ha tratado de mantener un tono equilibrado. Pero recientemente ha sugerido que Israel ha estado usando una fuerza desproporcionada e ""inmoral"" en Líbano y Gaza.

Dijo que particularmente está cerca de quienes se han visto obligados a huir de sus hogares y refugiarse de las bombas, y de las madres que lloran a sus hijos muertos y los que ""temen alzar la mirada por temor al fuego que llueve del cielo"".

La cancillería alemana en Berlín estaba adornada con una cinta amarilla, símbolo del deseo de que sean liberados los rehenes israelíes tomados por Hamás, de los cuales unos 100 siguen en cautiverio y muchos de los cuales podrían estar muertos.

Se leyeron en voz alta los nombres de cada una de las personas asesinadas y tomadas como rehenes en el ataque, frente a la Puerta de Brandeburgo en Alemania a partir de las 5:29 de la mañana hora local, la hora exacta que empezó el ataque un año atrás.

El canciller alemán Olaf Scholz, dirigiéndose a ""nuestros queridos amigos en Israel"", declaró: ""Los acompañamos en su sentimiento ... nos plantamos a su lado"".

Pero también mencionó el sufrimiento de los palestinos en Gaza y expresó que ""la experiencia diaria de violencia y hambre no es una base sobre la cual pueden crecer cosas buenas"".

Scholz, ante una conferencia en Hamburgo, dijo que Alemania está tratando de lograr un cese al fuego y la liberación de los rehenes y ""un proceso político, aunque esté hoy más lejos que nunca"". Afirmó que el objetivo debe ser una solución de dos Estados y que ello es sólo posible si es evitada una conflagración regional más amplia, añadiendo que Hezbollah e Irán deben cesar sus ataques contra Israel.

Los periodistas de The Associated Press Geir Moulson en Berlín, Diane Jeantet en París, Nicole Winfield en Roma, Mari Yamaguchi en Tokio, Vanessa Gera en Varsovia y Charlotte Graham-McLay en Wellington, Nueva Zelanda, contribuyeron a este despacho."
EEUU ha gastado cifra récord en ayuda a Israel desde inicio de guerra en Gaza,AP NEWS,,https://apnews.com/us-news/general-news-49f2e56e58227c28dc174d0d1959a00e,2024-10-07T15:00:39Z,"WASHINGTON (AP) -- Estados Unidos ha gastado un récord de al menos 17.900 millones de dólares en ayuda militar a Israel desde que comenzó la guerra en Gaza y llevó a una escalada del conflicto en todo Oriente Medio, según un informe del proyecto Costos de la Guerra de la Universidad de Brown, publicado el lunes al cumplirse un año de los ataques del grupo armado palestino Hamás contra Israel.

Se han destinado 4.860 millones de dólares adicionales a la intensificación de las operaciones militares estadounidenses en la región desde los ataques del 7 de octubre de 2023, dijeron los investigadores. Eso incluye los costos de una campaña liderada por la Armada para sofocar los ataques contra el transporte marítimo comercial por parte de los hutíes de Yemen, aliados de Hamás y respaldados por Irán.

El informe -- completado antes que Israel abriera un segundo frente, esta vez contra el grupo político-paramilitar Hezbollah, también respaldado por Irán, en el Líbano, a fines de septiembre -- es uno de los primeros recuentos de los costos estimados de Estados Unidos, mientras el gobierno del presidente Joe Biden respalda a Israel en sus conflictos en Gaza y Líbano y busca contener las hostilidades de los grupos armados aliados de Irán en la región.

El costo financiero se suma al costo en vidas humanas: los milicianos de Hamás mataron a más de 1.200 personas en Israel hace un año y tomaron a unos 250 como rehenes. La ofensiva de represalia de Israel ha cobrado la vida de casi 42.000 personas en Gaza, según el Ministerio de Salud palestino, que no distingue entre civiles y combatientes en su recuento.

Al menos 1.400 personas en Líbano, incluidos combatientes de Hezbollah y civiles, han muerto desde que Israel amplió sus ataques en ese país a fines de septiembre.

Los costos financieros fueron calculados por Linda J. Bilmes, profesora de la Facultad de Gobierno John F. Kennedy de Harvard, quien ha evaluado los costos totales de las guerras estadounidenses desde los ataques del 11 de septiembre de 2001, y sus colegas investigadores William D. Hartung y Stephen Semler.

Entre otros datos, se destaca que Israel es el mayor receptor de ayuda militar estadounidense en la historia, con 251.200 millones de dólares ajustados a la inflación desde 1959, según el informe.

Aun así, los 17.900 millones de dólares gastados desde el 7 de octubre de 2023 en dólares ajustados a la inflación son, con mucho, la mayor cantidad de ayuda militar enviada a Israel en un año.

Gran parte de las armas estadounidenses entregadas en el año fueron municiones, desde proyectiles de artillería hasta destructores de búnkeres de 2.000 libras y bombas guiadas de precisión.

Los gastos van desde los 4.000 millones de dólares para reponer los sistemas de defensa antimisiles Cúpula de Hierro y Honda, de Israel, hasta dinero en efectivo para fusiles y combustible para aviones, según el estudio."
"La devastadora guerra entre Israel y Hamás, en cifras",AP NEWS,,https://apnews.com/world-news/general-news-968e13264ffd387956467999668cb62c,2024-10-07T14:18:24Z,"La ofensiva israelí del último año en Gaza, iniciada en respuesta al ataque de Hamás del 7 de octubre, ha matado a decenas de miles de palestinos y provocado una destrucción generalizada en el asediado enclave costero.

A continuación, algunas cifras que muestran la escala de la muerte y devastación. Las fuentes incluyen el gobierno israelí, el Ministerio de Salud de Gaza y agencias de Naciones Unidas.

Número de rehenes que siguen con vida en Gaza: 66, incluidos 2 anteriores al 7 de octubre.

Número de cautivos en Gaza que se cree han muerto: 35, incluidos 2 anteriores al 7 de octubre.

Número de milicianos que el Ejército israelí dice haber matado: más de 17.000.

Número de soldados israelíes caídos desde el 7 de octubre: más de 720.

Número de cohetes lanzados de Gaza a Israel desde el 7 de octubre: más de 9.500.

Número de palestinos desplazados en Gaza: unos 1,9 millones

Porcentaje de población de Gaza que se ha desplazado: en torno al 90%.

Número más alto que se alcanzó de israelíes desplazados por ataques desde Gaza: más de 58.000.

Número de israelíes desplazados ahora del sur: unos 5.300.

Porcentaje de territorio de Gaza bajo órdenes de evacuación israelíes: en torno al 90%.

Número de estructuras destruidas o con daños moderados: más de 120.000.

Número de viviendas dañadas o destruidas: más de 215.000.

Porcentaje de estructuras dañadas o destruidas: 66.

Total estimado de coste de los daños en los tres primeros meses de guerra: 18.500 millones de dólares.

PIB más alto reportado en Cisjordania y Gaza, en 2022: 19.170 millones de dólares.

Porcentaje de carreteras importantes dañadas o destruidas: más del 92%.

Porcentaje de instalaciones médicas dañadas o destruidas: más del 84%.

Porcentaje de instalaciones de agua y alcantarillado dañadas o destruidas: 67%.

Cantidad diaria de agua sin tratar y aguas residuales que llegan al mar desde Gaza: 60.000 metros cúbicos.

Longitud de tendidos eléctricos destruidos: 510 kilómetros (320 millas)."
